{
  "version": "1.1.0",
  "lastUpdated": "2026-05-25T14:09:02Z",
  "categories": [
    {
      "id": "git-version-control",
      "name": "Git & Version Control",
      "description": "Skills for git workflows, commits, branching, and GitHub operations",
      "icon": "\ud83d\udd00"
    },
    {
      "id": "code-quality",
      "name": "Code Quality & Refactoring",
      "description": "Skills for code reviews, refactoring, linting, and best practices",
      "icon": "\u2728"
    },
    {
      "id": "documentation",
      "name": "Documentation",
      "description": "Skills for writing docs, READMEs, PRDs, and technical writing",
      "icon": "\ud83d\udcdd"
    },
    {
      "id": "diagrams",
      "name": "Diagrams & Visualization",
      "description": "Skills for creating Mermaid, PlantUML, Excalidraw diagrams",
      "icon": "\ud83d\udcca"
    },
    {
      "id": "testing",
      "name": "Testing",
      "description": "Skills for unit tests, integration tests, E2E, and test automation",
      "icon": "\ud83e\uddea"
    },
    {
      "id": "api-backend",
      "name": "API & Backend",
      "description": "Skills for REST APIs, GraphQL, databases, and backend development",
      "icon": "\ud83d\udd0c"
    },
    {
      "id": "frontend-ui",
      "name": "Frontend & UI",
      "description": "Skills for React, Vue, CSS, components, and web design",
      "icon": "\ud83c\udfa8"
    },
    {
      "id": "devops-cicd",
      "name": "DevOps & CI/CD",
      "description": "Skills for pipelines, Docker, Kubernetes, Terraform, and deployments",
      "icon": "\ud83d\ude80"
    },
    {
      "id": "security",
      "name": "Security",
      "description": "Skills for security audits, vulnerability scanning, and secure coding",
      "icon": "\ud83d\udd12"
    },
    {
      "id": "data-analytics",
      "name": "Data & Analytics",
      "description": "Skills for data pipelines, SQL, Power BI, and data analysis",
      "icon": "\ud83d\udcc8"
    },
    {
      "id": "office-documents",
      "name": "Office Documents",
      "description": "Skills for creating and editing Word, Excel, PowerPoint, and PDF files",
      "icon": "\ud83d\udcc4"
    },
    {
      "id": "mcp-development",
      "name": "MCP Development",
      "description": "Skills for building Model Context Protocol servers and apps",
      "icon": "\ud83d\udd27"
    }
  ],
  "skills": [
    {
      "id": "git-commit",
      "name": "git-commit",
      "description": "Execute git commit with conventional commit message analysis, intelligent staging, and message generation. Supports auto-detecting type and scope from changes, generating conventional commit messages from diff, and intelligent file staging for logical grouping.",
      "shortDescription": "Generate standardized commit messages",
      "category": "git-version-control",
      "author": "github",
      "license": "MIT",
      "triggers": [
        "commit",
        "git commit",
        "commit message",
        "conventional commit",
        "/commit"
      ],
      "complexity": "beginner",
      "platforms": [
        "windows",
        "macos",
        "linux"
      ],
      "source": {
        "repo": "https://github.com/github/awesome-copilot",
        "repoName": "github/awesome-copilot",
        "path": "skills/git-commit/SKILL.md",
        "branch": "main"
      },
      "featured": true,
      "tags": [
        "git",
        "commits",
        "semantic",
        "changelog",
        "conventional-commits"
      ]
    },
    {
      "id": "refactor",
      "name": "refactor",
      "description": "Perform code refactoring with best practices. Analyzes code structure and suggests improvements for readability, maintainability, and performance.",
      "shortDescription": "Refactor code with best practices",
      "category": "code-quality",
      "author": "github",
      "license": "MIT",
      "triggers": [
        "refactor",
        "refactoring",
        "clean code",
        "improve code"
      ],
      "complexity": "intermediate",
      "platforms": [
        "windows",
        "macos",
        "linux"
      ],
      "source": {
        "repo": "https://github.com/github/awesome-copilot",
        "repoName": "github/awesome-copilot",
        "path": "skills/refactor/SKILL.md",
        "branch": "main"
      },
      "featured": true,
      "tags": [
        "refactor",
        "clean-code",
        "quality",
        "maintainability"
      ]
    },
    {
      "id": "anti-ui-slop",
      "name": "STOP UI SLOP",
      "description": "Stop generic UI before it ships. Turn real interface evidence into a product-specific design contract, implement the states the flow actually needs, and enforce a hard finish gate for React, Next.js, web, and iOS interfaces.",
      "shortDescription": "Stop generic UI with evidence, states, and a hard finish gate",
      "category": "frontend-ui",
      "author": "UIZZE",
      "license": "MIT",
      "triggers": [
        "stop UI slop",
        "review this UI",
        "make this interface product-specific",
        "finish gate",
        "generic dashboard"
      ],
      "complexity": "advanced",
      "platforms": [
        "windows",
        "macos",
        "linux"
      ],
      "source": {
        "repo": "https://github.com/uizze/uizze",
        "repoName": "uizze/uizze",
        "path": "skills/anti-ui-slop/SKILL.md",
        "branch": "main"
      },
      "featured": false,
      "tags": [
        "ui-design",
        "frontend",
        "design-systems",
        "code-quality",
        "anti-slop"
      ]
    },
    {
      "id": "prd",
      "name": "prd",
      "description": "Generate Product Requirements Documents from feature descriptions. Creates structured PRDs with user stories, acceptance criteria, and technical requirements.",
      "shortDescription": "Generate Product Requirements Documents",
      "category": "documentation",
      "author": "github",
      "license": "MIT",
      "triggers": [
        "prd",
        "requirements",
        "product requirements",
        "spec",
        "specification"
      ],
      "complexity": "beginner",
      "platforms": [
        "windows",
        "macos",
        "linux"
      ],
      "source": {
        "repo": "https://github.com/github/awesome-copilot",
        "repoName": "github/awesome-copilot",
        "path": "skills/prd/SKILL.md",
        "branch": "main"
      },
      "featured": false,
      "tags": [
        "documentation",
        "prd",
        "requirements",
        "product"
      ]
    },
    {
      "id": "excalidraw-diagram-generator",
      "name": "excalidraw-diagram-generator",
      "description": "Create professional diagrams using Excalidraw. Generates flowcharts, architecture diagrams, and visual documentation from natural language descriptions.",
      "shortDescription": "Create Excalidraw diagrams",
      "category": "diagrams",
      "author": "github",
      "license": "MIT",
      "triggers": [
        "excalidraw",
        "diagram",
        "flowchart",
        "architecture diagram",
        "visualize"
      ],
      "complexity": "beginner",
      "platforms": [
        "windows",
        "macos",
        "linux"
      ],
      "source": {
        "repo": "https://github.com/github/awesome-copilot",
        "repoName": "github/awesome-copilot",
        "path": "skills/excalidraw-diagram-generator/SKILL.md",
        "branch": "main"
      },
      "featured": true,
      "tags": [
        "diagrams",
        "excalidraw",
        "flowchart",
        "visualization",
        "architecture"
      ]
    },
    {
      "id": "plantuml-ascii",
      "name": "plantuml-ascii",
      "description": "Create PlantUML diagrams with ASCII output. Generates sequence diagrams, class diagrams, and more in text format.",
      "shortDescription": "Create PlantUML ASCII diagrams",
      "category": "diagrams",
      "author": "github",
      "license": "MIT",
      "triggers": [
        "plantuml",
        "uml",
        "sequence diagram",
        "class diagram",
        "ascii diagram"
      ],
      "complexity": "intermediate",
      "platforms": [
        "windows",
        "macos",
        "linux"
      ],
      "source": {
        "repo": "https://github.com/github/awesome-copilot",
        "repoName": "github/awesome-copilot",
        "path": "skills/plantuml-ascii/SKILL.md",
        "branch": "main"
      },
      "featured": false,
      "tags": [
        "diagrams",
        "plantuml",
        "uml",
        "ascii",
        "sequence"
      ]
    },
    {
      "id": "gh-cli",
      "name": "gh-cli",
      "description": "Use GitHub CLI (gh) for repository management, issues, pull requests, and GitHub operations directly from the command line.",
      "shortDescription": "GitHub CLI operations",
      "category": "git-version-control",
      "author": "github",
      "license": "MIT",
      "triggers": [
        "gh",
        "github cli",
        "gh pr",
        "gh issue",
        "github command"
      ],
      "complexity": "intermediate",
      "platforms": [
        "windows",
        "macos",
        "linux"
      ],
      "source": {
        "repo": "https://github.com/github/awesome-copilot",
        "repoName": "github/awesome-copilot",
        "path": "skills/gh-cli/SKILL.md",
        "branch": "main"
      },
      "featured": false,
      "tags": [
        "github",
        "cli",
        "gh",
        "pull-request",
        "issues"
      ]
    },
    {
      "id": "github-issues",
      "name": "github-issues",
      "description": "Create, manage, and organize GitHub issues. Includes templates, labels, and best practices for issue tracking.",
      "shortDescription": "Manage GitHub issues",
      "category": "git-version-control",
      "author": "github",
      "license": "MIT",
      "triggers": [
        "issue",
        "github issue",
        "create issue",
        "bug report",